id,segment,label
13,老實說我也不知道我到底是不是憂鬱症,1
15,尤其去年初曾經有一段時間達到重度憂鬱症,1
16,如果劃傷自己會不會好些,1
17,其實我覺得自己有強迫症,1
18,我知道我有輕微的強迫症,1
23,有點焦慮症的傾向,1
24,我應該是有精神病,1
26,不把頭髮扯到分岔後拔下來我不會善罷甘休,1
27,但最近幾乎天天都有自殺的念頭,1
28,這是憂鬱症前兆嗎?,1
30,甚至會有想自我了斷的念頭...,1
31,那好像還有一點強迫症的感覺,1
32,是所謂的恐懼症嗎,1
33,強迫症讓我很不舒服,1
35,之前有一陣子低潮期 被男友說有憂鬱症,1
37,請問這是躁鬱症還是精神分裂症的症狀嗎?,1
38,長期的情緒低落、失去動力、失眠、自殺意圖、排斥社交，每天晚上哭到凌晨才睡得著。,1
40,猜測在異地的我，似乎已患有被害妄想症,1
43,我生病了嗎??躁鬱症?精神分裂?還是...?,1
45,線上的測驗都顯示我有憂鬱症,1
47,我以前確診是人格疾病患者,1
48,然後醫生說只是憂鬱症,1
50,甚至我有好幾次傷害自己的念頭,1
52,自殘沒用也不想浪費血了,1
53,藥吃了一大堆 (也拿來od了無數次),1
54,但從面試前我就天天以淚洗面 頭痛 甚至有幻聽,1
55,有時候會懷疑這樣的自己有憂鬱症嗎,1
56,懷疑自己是不是患憂鬱症,1
57,所以不確定是不是憂鬱症,1
58,還是真的是我有強迫症甚至焦慮症,1
59,這是恐慌症嗎 我自己都覺得我病了,1
60,我擔心這是種強迫症,1
62,會是恐慌症嗎,1
63,這次也想把藥一次吞一堆,1
64,還是有廣泛焦慮症的可能呢？,1
65,我上網看資料 看到憂鬱症的症狀我都吻合,1
66,結果醫生跟我媽說 我是憂鬱症,1
68,也不確定自己是不是有精神上的疾病,1
69,只要旁人說話太大聲還是不何意 就會很生氣很生氣的想要掀桌子或打人,1
77,因我已長期的憂鬱症困擾許久，,1
78,或者...有推薦看PDST的身心門診也可以…,1
79,"覺得自己有一點暴食症的初期症狀，有一點憂鬱症初期症狀",1
80,一直一直被ED困擾著,1
81,我暴食但是不會催吐因為我討厭胃酸的味道，但是我會吃到很撐很想吐，,1
82,可是我的暴飲暴食  嘔吐已經無法克制了,1
83,厭食症…這是從來都沒有想過會發生在我身上的病狀，,1
84,"暴食發作的時候明明知道不能這樣吃還是控制不了，吃過六個便當，大量的麵包餅乾，常常是超商每一種麵包都買來吃掉，一千塊的零食亂買全部吃掉，然後吃瀉藥，拉到只剩水便我才滿意。",1
85,我對於自己的暴食症是非常小心守密的,1
86,我寧可吐掉剛剛吃過的東西，再繼續吃,1
87,在要敲下鍵盤分享自己從暴食症慢慢康復的這四年來點點滴滴,1
88,"看到食物我就會不斷的吃...直到很想吐...等不這麼想吐之後又會繼續吃",1
89,兩年前我也吞藥自殺過,1
90,最近一直想著死的事情，,1
91,憂鬱症困擾我好幾年了,1
92,去觀看一些思覺失調症的影片 真的跟我的狀況好像,1
93,"我曾經2013年確診過泛性焦慮症 最近一直有想輕生的意念",1
94,拿著一旁的刀子劃著自己的手,1
95,希望 專門看恐慌焦慮跟憂鬱、壓力創傷症候群,1
96,我是一個慣性OD的患者,1
97,"看了版上的精神疾病版跟憂鬱症版還有暴食症版 如果以上這些症狀都有",1
98,最近感覺應該是有憂鬱症，,1
99,所以最近精神很糟，甚至有點憂鬱症兆,1
100,請推薦台北看失眠憂鬱症躁鬱症的診所,1
101,目前的狀況是可能有輕鬱症,1
102,現在心裡也可以接受憂鬱症的可能了,1
103,憂鬱症真的算是心理的癌症吧..,1
104,終於下定決心離家慢性自殺,1
105,因為有滿多憂鬱症的症狀 所以懷疑自己憂鬱症很久了,1
106,"作出自我傷害.....的行為 以上的症狀...完全跟我相符合",1
107,我認為自己應該是第二型躁鬱症,1
108,"我在學校、公司會很焦慮 提不起勁學習 容易分心 回到家就有嚴重的拖延病 無法積極 注意力也不集中 沒有像在公司一樣焦慮 但會煩惱 心情悶",1
109,我在網路上看到各種跟躁鬱症相關的資料，我幾乎百分之九十五都吻合,1
110,後來好久沒有發生的咬牙齒啊、失眠、崩潰大哭、想撞牆想打自己的狀態就接踵而來。,1
111,從以前開始或多或少會有點自殘的行為,1
112,"看著網路上的憂鬱症量表 還是跟一如以往一樣的最高分",1
113,"我的心情跟著週遭的小事起起伏伏 拿最近的來說好了 過年期間陰雨綿綿又寒冷 我有呼吸道過敏又氣喘 整個心情就很鬱悶",1
114,"我覺得吃藥是不是在讓自己延續這根本不想再活的人生，然後因為就診紀錄活了也一輩子不能保險，我沒小孩沒家庭又沒錢活到老不是更累嗎？",1
115,不知道以上的情況是否算是恐懼症？,1
116,我就知道我有幽閉恐懼症..,1
117,當時的我覺得自己可能有精神上的疾病,1
118,之前在國外時有一陣子也不時出現自殺或想撞牆的念頭，,1
119,"也做了好幾個憂鬱症與躁鬱症的測驗 看到每個結果都幾乎是最高分",1
120,自己有些症況都符合社交焦慮症,1
121,最近瞭解到自己可能有強迫症後,1
122,剛剛查了一下舊文發現還蠻類似ADHD的..,1
123,症狀大約是憂鬱 自殘 情緒不穩,1
124,我google相關症狀後覺得自己已經是焦慮症,1
125,我才了解到什麼叫社交恐懼症這個詞,1
126,第一次看到ADHD的介紹，覺得自己應該是。,1
127,"會感覺胸口有什麼堵住了，然後在房間裡爆哭，也會輕輕抓捏自己來試圖分擔情緒。",1
128,加上自己觀察我覺滴我憂鬱正挺嚴重滴,1
129,我覺得好像憂鬱症該有的情況我都不少,1
130,想到醫院診斷自己是否有憂鬱症的念頭......,1
131,心理的焦慮遠超越了小孩到來的喜悅,1
132,患有輕度憂鬱症 輕度還重度我個人不知道,1
133,我也會嚴重焦慮無法睡眠,1
134,最近我又精神狀況不太好,1
135,我這樣算是恐慌症嗎?,1
136,焦慮症似乎與我情況最符合,1
137,"我不知道我這樣算不算有病，剛剛去做憂鬱症自我檢測分數是37",1
138,現在心裡也可以接受憂鬱症的可能了,1
139,我覺得我已經得了憂鬱症了,1
140,基隆哪間醫院或診所有在醫治心理病的？,1
141,最近才覺得像是BPD傾向,1
142,心中還會有理性的聲音問自己是不是憂鬱症了,1
143,經常有自殺想法,1
144,最近瞭解到自己可能有強迫症後,1
145,我的強迫症現象自己感覺有越來越嚴重,1
146,我的憂鬱症好像很嚴重,1
147,你連我有憂鬱症都不知道,1
148,我覺得我好像有強迫症,1
149,我就是不知足 我就是爛草莓 才會得憂鬱症,1
150,很容易哭、對什麼事都沒有興趣、每天很沒精神、覺得身體很累,1
151,我想治好我的厭食症,1
152,我覺得我有憂鬱症,1
153,我知道如果要治療這種恐懼症好像要去精神科,1
154,那有憂鬱症的我如果本來就很笨身體也不好 豈不是只會更悲慘?,1
155,我就是得了憂鬱症,1
156,仔細想想憂鬱症也不是什麼太嚴重的病,1
157,我朋友說我是躁鬱症  好像真的是他說的那樣,1
158,我在猜我會不會是憂鬱症,1
159,每天真的都憂鬱到好想死,1
160,才剛走出巷口又覺得恐慌症快發作了,1
161,感覺我好像過動症,1
162,痛苦到頂點的時候還是忍不住拿刀劃開皮膚,1
163,有沒有人可以推薦我台中地區不錯的心理醫生可以醫好我的焦慮症?,1
164,我覺得我有憂鬱症欸,1
165,我快受不了我的憂鬱症了,1
166,憂鬱症卻中度轉成重度並伴隨妄想症出現,1
167,昨天到今天找了網路上好幾個憂鬱症測量表來做 都是中度，有兩個測量結果還是重度,1
168,想問問其他人我現在到底是憂鬱情緒， 還是憂鬱症,1
169,我想拿憂鬱症的藥,1
170,躁鬱痛苦死了,1
171,同時我發現自己疑似有社交恐懼症,1
172,尤其對有憂鬱 症的我們來說，,1
173,前幾天上網找憂鬱量表(？ 填出來結果發現竟然意料之外的高？,1
174,有時候覺得自己是不是只是想被判定是憂鬱症這樣好像就可以把事情怪在這上面了,1
175,不然我真的要od了,1
176,我活得好痛苦。,1
177,我因為從小就有的強迫症及焦慮症,1
178,是季節性憂鬱期又出現了吧,1
179,躁鬱症的情緒擺盪真的很痛苦,1
180,對方要是知道我有躁鬱症,1
n_12416,今天的崩潰是因為心理治療還是真的太冷了呢？,1
n_13247,最好的朋友最近被診斷憂鬱症,1
n_183,發現是中度抑鬱症,1
n_13140,本身家人有憂鬱的傾向 如同大多數的病友一樣也有嚴重失眠的問題,1
n_12929,開使吃新的抗鬱劑煩x閃,1
n_12822,創傷為主，憂鬱、諮商的主題為輔，都是正規醫療觀點,1
n_12887,我也長期憂鬱.覺得自己凡事都好慘.活的很痛苦,1
n_12747,找到適合自己的心理專業人士，也提供專業心理健康資訊及資源,1
n_12641,我吃藥吃到乾眼症 有抗憂鬱的 也有幾顆bzd 最近增加了牟靜,1
n_13138,建議長期患有憂鬱、神經衰弱或是患有精神病的病人應該要服用B12,1
n_12689,較早發病的躁鬱症患者一開始多以憂鬱期為主，並且通常會經歷多次憂鬱期之後才會有輕度狂躁,1
n_12781,特別是精神分裂症，這是精神科的大宗客戶，,1
n_12337,我承認我已焦慮 失去重心,1
n_12695,被醫生診斷為第二型躁鬱,1
n_176,憂鬱就不止 總以為事情告一段落 卻又再來一個回馬槍,1
n_12550,還成為大家的拖油瓶 也不知焦慮和敏感又發作 變的更自卑不敢與人互動,1
n_13171,我覺得我真的會瘋掉 現在開始100%焦慮,1
n_162,好想趕快把這種莫名焦慮感消除,1
n_12938,因為情緒差有憂鬱症,1
n_13114,心理上的壓力有減少一些，但是生理上還是覺得非常非常累,1
n_13153,現在能減少躁的感覺就好 雖然輕躁確實開心 但是還是不喜歡那種感覺 很怕隨時變躁狂,1
n_12449,這幾天開始睡前滿焦慮的 有時候嚴重恐慌要吃鎮定劑,1
n_165,去諮商的前幾次就是把困住自己的故事講一講，然後就漸漸地不知道要跟諮商師聊什麼了 。,1
n_12957,明天要去看醫生 不知道心理衡鑑的結果出來沒,1
n_12785,覺得可能有憂鬱症或是相關的身心疾病,1
n_12776,最近常常做惡夢 夢到許多現實中的現實 只有吃思樂康的日子才會有美夢 ,1
n_13021,諮商結束了 但卻不代表我好了,1
n_13032,距離上次諮商已經是好幾個月前,1
n_12364,正氣到連旁邊的躁症病人都會跳出來幫忙罵,1
n_13253,醒了就是焦慮狀態也睡不回去 昨天回診和醫生討論說想從美妥平換回思樂康,1
n_12944,這個世界雖然難以生存，卻很溫暖 想到心理師,1
n_12638,可是怕人的毛病讓我走不久 很害怕 這比起焦慮，接近恐慌吧 ,1
n_12635,我心理的狀況發生過的事情怎麼辦,1
n_12443,有精神病的就醫紀錄,1
n_13008,很擔心她是不是因為已經有憂鬱症的徵兆,1
n_181,我先跳下去就不用再憂思恐懼,1
n_12703,諮商師說我沒有軟弱，我做的這許多事都是證明，只是世界上沒有最好,1
n_13136,從此患了憂鬱症，經常有負面想法，到現在還在吃藥控制,1
n_12315,有時候覺得更焦慮了，有時候又感到安心，不是只有自己感到焦慮,1
n_12374,因為焦慮恐慌服用藥物有一段時間了,1
n_12739,醫生給的建議是諮商,1
n_12618,很不舒服 很憂鬱 不喜歡長效針退的感覺 不想打長效針了 但是好像除了長效針沒辦法,1
n_13116,但沒有一個穩定的社會角色仍是讓我感到慌，又精神狀況在適應社 會上有蠻大困難,1
n_13027,心理治療終於在軌道上了,1
n_12946,卻憂鬱到極點 感覺不到一點快樂 真的病了 只能靠藥物,1
n_12450,免費諮商師說焦慮不吃藥這樣很好,1
n_12851,躁鬱症的鬱症跟憂鬱症的鬱症不好分,1
n_151,每天每小時都在抗焦慮，一肚子抗焦慮的藥,1
n_12513,每個禮拜固定的諮商日,1
n_12612,突然好懷念我的思樂康,1
n_12380,男友家族有憂鬱症病史，我覺得他有可能也有憂鬱症,1
n_12654,昨天久違的諮商 心理師問我要談什麼,1
n_12773,曾經在諮商時探究過這個感覺的源頭,1
n_12313,近日才發現姊姊有憂鬱症,1
n_13229,因為之前也有朋友有重度憂鬱症,1
n_12482,現在在漢生西路一家身心科診所看診,1
n_12630, 好痛苦，有時好想離開這個人世,1
n_12934,他自爆金曲獎前夕因為想不開吞藥自殺，昏迷了5個小時後才醒來，事後他求助心理諮商師,1
n_145,如果是憂鬱症這一類型精神疾患， 會常常伴隨著憤怒的情緒嗎？,1
n_12883,我想死。我想死。我想死。,1
n_12940,我已經多吃一倍情緒穩定劑了 還是無法睡著 思路康和利福全對我來說太強了,1
n_12771, 還有沒有人一直去看醫師諮詢,1
n_13178,想問對於精神疾病，會談(或其他的非藥物治療)到底重不重要，抑或者藥物才是主力,1
4,需要看醫生嗎,1
12,可是我不知道我到底該看精神科還是神經科還是心臟科,1
14,雖然沒有大學時期那麼嚴重 但總會讓我想起那段過去 我是不是要再去看心理醫生？,1
19,我該去看醫生嗎...,1
20,我覺得我該去看醫生了,1
21,該去看醫生嗎?,1
22,請問我現在是不是 應該去找醫生做一下諮詢呢?,1
25,我不知道該不該去看醫生 還是過陣子就會好...不知道有沒有人能給一點意見...,1
41,念輔導方面的朋友要我找學校的輔導室談談， 但我卻沒辦法放開來說，大概是因為有那樣情形的頻率不算太高， 也害怕對方沒辦法理解或相信我的狀況，所以一直在猶豫要不要去,1
44,我要看醫生嗎? 可以不要看嗎?不看的話會自然好嗎? (因為我不敢 我連來這裡問都一直退縮,1
24,藥吃了一大堆 (也拿來od了無數次),0
33,這次也想把藥一次吞一堆,0
58,我是一個慣性OD的患者,0
42,一直一直被ED困擾著,0
137,不然我真的要od了,0
165,是不是對的、 合乎時宜的 還好至少目前為止沒有後悔,0
166,真的覺得累 很累很累 打從心底的疲倦,0
166,對於這段關係和所有一切 什麼期待 什麼的什麼都一丁點沒有剩下,0
166,什麼都不想要         可以不要再傳訊息來嗎,0
167,除了人資 主管和老闆 不會有人知道你的資歷,0
167,我也懶得說自己有過什麼 來到新的地方就是重新累積,0
167,加油啦 嗚嗚嗚嗚 早上上班前背 結束後,0
167,老闆等在門口 問我星期六晚上的緊急事件後續,0
167,唉唉唉 完全沒有想到老闆會來找我 只顧著說處理過程和結果,0
167,也沒時間想怎麼說對自己有利 至少目前主管是肯定我的,0
168,坐在自己的空間 被業務推銷買套書 他的話術漏洞百出,0
168,再說我只會買我想看的書 其他一律沒興趣,0
168,說什麼星加坡賣900 他們只賣400多,0
168,我沒興趣的東西10元都是浪費 本來要唸書都沒唸到了,0
168,他講完介紹之後 我說我目前不想買書 他就說有試閱版本,0
168,我說那個我也不想買 他就摸摸鼻子離開了,0
168,我曾經試圖打斷他 說我不想買 他還是很堅持要講完,0
168,根本浪費我時間 我想跟他打聽 是哪個智障放他進來的,0
168,他卻說不能透露誰有買 就很智障的理由,0
168,根本無法相信 隨便 這種都離我遠一點,0
168,煩死了 浪費我的寶貴小偷時間    ,0
169,華人健康網 記者張世傑台北報導 2013年3月20日,0
169,1233 春天是躁鬱症好發季節， 因此在古時候有所謂桃花癲的說法。,0
169,且容易有復發傾向， 造成認知與社會職業功能逐步退化，,0
169,建議患者家屬應該給予患者適當支持， 幫助患者養成服藥習慣，,0
169,以免舊病復發或病況惡化。  大林慈濟醫院身心醫學科陳廣鵬醫師表示，,0
169,曾經發生過親人死亡、 離婚、 感情失落，,0
169,以及失業等生活重大創傷， 而其它發病原因則是長期累積的慢性壓力，,0
169,或缺少社會支援等。  1位54歲的林姓婦人，,0
169,丈夫因車禍驟逝， 原本一直垂頭喪氣、,0
169,沉默寡言陷於憂鬱的狀態中 ， 但之後突然精神煥發，,0
169,還打扮得光鮮亮麗， 而且侃侃而談， 情緒由憂鬱逆轉為急躁，,0
169,直到服藥持續治療2周後， 症狀緩解才恢復平靜的情緒與合宜的言行。,0
169,精力旺盛、 性需要增加， 睡眠的需要量減少、,0
169,好講話、 易怒、 注意力分散不易集中，,0
169,過動症、 酒精濫用及其它物質濫用、 強迫症、,0
169,而且無症狀期的長度通常會隨著年齡的增長而減短。,0
169,要注意患者因情緒過度高亢而可能失控的行為。,0
169,3. 支持：在患者發作後恢復正常時，,0
169,要給予其正面情緒的支持， 特別是不要對患者在發作期間的表現予以苛責，,0
169,要體諒他們生病的痛苦與無奈， 以免造成其自信心的受挫。,0
169,4. 服藥：平時症狀未發作、 情緒正常時，,0
169,親友應設法使患者養成良好的服藥習慣以預防再發。,0
169,5. 減壓：減少患者的壓力及給予適當的情緒支持，,0
169,並持續給予關心。  資料來源 //.,0
170,圖書館有一本書叫 中國明視氣功 我有練,0
170,每天練八次 每次練約15分鐘 每次練完,0
170,眼睛都會分泌淚水 但是近視要減輕 很困難,0
170,所以還是要少玩手機 可以查查看圖書館,0
170,中國明視氣功 如果圖書館沒有 可以用買的,0
170,我買一百多元而已 可是還是要少玩手機,0
171,飼主剛領養可能沒惡意 但幼貓像難民那樣全是肋骨,0
171,還只餵一天需要熱量的一半 我看到都難過,0
171,網路資訊那麼發達 瘦成這樣常識也知道不是以控制熱量為優先吧,0
171,不知道講什麼。  就算知道不是惡意還是心裡忍不住很生氣,0
172,得罕病快三年了 從一開始積極尋求治療,0
172,到現在家人都在勸我與他共存 這個病死不了大概也醫不好了，,0
172,每天折磨我 只有睡著的時候感受不到痛苦，,0
172,所以變的很愛睡覺 我要怎麼跟這個病共存，,0
172,你們不了解我的痛苦， 才能輕易說出要我帶著病活下去這種話,0
172,為了它我已經拋下所有的夢想跟理想， 只希望能夠有足夠的力氣工作養活自己,0
172,如果能夠有健康的身體， 我可以什麼都不要,0
173,一個星期了 這一個禮拜都沒有跟她聯絡,0
173,好想知道他過得好不好 還是會默默地看他的,0
173,看看有沒有新的男生出現 看看有關於我的文章有沒有被刪掉,0
174,為什麼要讓我身邊的人也這樣 我希望他們可以快樂的過日子,0
174,不要像我一樣痛苦 明明是個好人 為何非得要這樣對待他。,0
174,心情真的很糟 好想抱著他哭 很心疼。,0
175,之前在日間病房的時候， 職能治療師因為我想考身特，,0
175,幫我找了很多歷屆試題， 誰知道我 後來一雷，,0
175,被抓去住院做電療， 就全部忘記了。 ,0
175,不僅忘記我讀過的內容， 甚至連我做過題目都不知道，,0
175,是我最近整理房間才發現的。  最近聽聞老師生孩子了，,0
175,回診時遇到老師的職代， 心裡有種複雜的感覺，,0
175,一個人是可以代 替的嗎？ 就算只有職務，,0
175,他也不再是老師了， 更何況這些剪不斷理還亂的種種牽絆。,0
175,老師， 你是好人， 我謹以一位受過你幫助的病友身份，,0
175,望你以及所有你愛的人幸福， 如此 ，,0
176,想_的大家 有聽過死亡體驗嗎？  就是幫你辦,0
176,別式 家人說話. .  然後你躺在棺材裡等等,0
176,//. . ///123434 之前好像兩廳院有辦過,0
176,大家會想參加嗎. . . . . .,0
176,感覺也很需要勇氣 這好像可以完成_的慾望,0
177,暗黑不朽上線後整個被罵爆， 看著一代經典殞落讓人不勝唏噓。,0
177,現在想想， 老遊戲加上個Ｍ後好像普遍評價都不是很好，,0
177,印象中只有天地劫的評價還算可以， 但整體聲量似乎也挺差的。,0
177,不知道大家有沒有哪些遊戲寧願它就這樣爛在土裡，,0
178,好懶 又三天沒洗澡了 今天去拜拜 跟菩薩講了些話,0
178,希望能保佑我 感覺暢銷針退了？  禮拜一看看可不可以去看醫生吧,0
179,太早出門 晚上要去聽演唱會 太早出門,0
179,剛吃完中餐超無聊 回家也不是 去哪也不對,0
179,剛剛手摸辣椒 又碰眼睛 辣啊 好熱 天氣又很濕,0
180,這幾天的心思都繫在一個人身上 有點可怕,0
180,再度體驗到了站在懸崖的感覺 只是我的不安感,0
180,可以讓自己先意識到 而不是焦急著想抓住某人,0
180,成長 值得鼓勵 或許這樣可以在再相處個幾天,0
180,希望囉 祝大家都不要當悲劇女主角 不要哭哭,0
181,想到自己逃難式的離職經驗 跳上飛機 等到飛機開始衝刺,0
181,機長開始廣播 才真正覺得自己自由了 一切焦慮不安才真正的放下,0
181,結束了一百多天的折磨 那個出差也想著跳海自殺的日子,0
181,我也很認份的過了三年兢兢業業的日子 在上一間公司很認真的獲得好評滿滿,0
181,結果現在自己又落入這團泥淖中 前兩次沒有走完聘期離職,0
181,都有在教學醫院的醫生 開給我的診斷證明書,0
181,現在大概很難再請哪個醫生開給我 雖然也不是不可能,0
181,但是覺得孤單：（ 醫生沒有錯 他很清楚的點出這份工作的不適切,0
181,但是他現在在診所也無法開什麼證明書了,0
182,但治療方式卻不一樣 所以必須要分  另外,0
182,但是會覺得全身充滿活力 整個人也會變得比較有自信,0
182,臨床特徵是話多且快 思緒也會比較跳耀,0
182,性史比較旺盛 而且會有本能性的購物慾望,0
182,其他地方我不清楚 在成大醫院精神科的病人很少復發住院,0
182,大概跟我們有盪鞦韆團體有關 衛教的比較好,0
182,病人醫囑遵從度比較高吧  八卦喔…我懷疑艾成是雙極性不是單極性,0
182,其實是有藥物可以讓他好好休息的 在這邊呼籲如果身邊有,0
182,我們不敢說很厲害可以萬事通 但開個藥讓病人好好休息,0
183,我只擔心我那一份 爸爸最近越來越晚回家,0
183,雖然看起來是在進修夜間部 但很多人也是到最後一刻才發現,0
183,介入或被介入婚姻 老爸老媽幸不幸福 那也不甘我的事,0
183,我只擔心我那一分被不知名的弟弟妹妹分走,0
183,可能我電影看太多 但我也不是太在意他的活,0
183,只在意他的死 他的活不要傷害我就夠了,0
183,其他都不想知道也不想管 哪天得知他的死訊,0
183,我應該會內心狂喜不已 如果我哭了 也是喜極而泣的,0
183,看似不孝 但那些陳年語言 肢體和精神的暴力,0
183,也該給點補償吧 前幾個星期才被講 你他媽的真的很髒,0
183,但我只是沒蓋杯蓋而已 我的這些扭曲並不是我樂意長成這樣的,0
183,誰不希望一個有家可回的幸福人生 今天工作真的是有夠悶的,0
183,為這種垃圾及掰長官做事 真是晦氣的事,0
183,至少能燃起一些考試的意志吧 加油 為自己的人生努力,0
183,那些髒東西都是你前進的動力     ,0
184,晚上忽然想起你離世那天的狀況，  情緒掉了下去，,0
184,我不認為是病症，  而是無法彌補及挽回的痛楚和自責。,0
184,然後又想起七月離世的白貓，  那時我以為可以和你們一起走，,0
184,反而沒有那麼大的悲傷，  可是不想活著，,0
184,卻死不了. . . . .  我把貓的照片放上臉書，,0
184,你的照片我考慮很多次，  還是決定尊重你，,0
184,沒放上臉書， 你一直不喜歡拍照，  手機裡只有少數幾張是你自己要拍，,0
184,又同意我留下來的。  對不起， 沒有照顧好你們，,0
184,請你們原諒我，  謝謝你們陪伴我， 我愛你們。,0
184,在另一個世界好好的照顧彼此。  對不起，,0
185,本魯要去看醫生， 但是想請整天， 又覺得有一個半天明明就沒事情，,0
185,但是只去半天效率感覺也不怎樣， 大家看醫生通常會請整天還半天啊?,0
186,要請朋友吃飯  但是希望預算是一個人五、,0
186,六千起跳， 破萬也沒關係  燒肉(我知道有些店是點和牛可以有),0
186,火鍋  或是法式料理 日式料理  都可以,0
186,不知道有什麼餐廳是有符合的  網路上好像查不太到,0
187,這個天氣 以前在前公司都會想睡覺 甚至真的趴下來睡,0
187,現在真的當主管反而不敢 嗚嗚 好想睡覺啊,0
188,服了藥， 但刻意不服安眠藥，  想試試看是否就睡不著。,0
188,如果我當時果斷辭職就好了，  也許不會有那麼多後續，,0
188,也許不會有憾事發生。  我不害怕外在了，,0
188,相反的， 早點了結也好。  把畫作上傳，,0
188,還被憎惡我的人按讚時， 我就確定了，,0
188,逼自己連續兩天出門也是， 本來想繼續的，,0
188,但真的累了。  因緣聚集就會有結果了。,0
188,好多多年未見或未說話的人一起關心， ,0
188,用淡淡的明褒暗貶說著， 不同的人卻用相同的話語，,0
188,想做什麼、 想說什麼都無所謂，  但沒必要浪費彼此時間，,0
188,假作關心，  願意對錯誤， 明確向對方指出的人，,0
188,反而更加珍貴。  原本不是廣交善緣的類型，,0
