id,segment,label
240,如果可以 這樣就好但這就是理想。 我喜歡正直友善的人有品德的人會為其他人著想的人，,0
240,覺得社會 上遇到比較真的沒心機的純真的人真的好少。,0
240,我就是一個蠻傻蠻單純的人， 但會有你自己強了別人才會看得起你。,0
240,人生存在的意義是什麼？ 我的人生只能投機取巧永遠去汲汲營營我也做不下去,0
241,//. /1600 來來去去這麼多人,0
241,真的能安安靜靜好好待一起 舒適地靜默著,0
241,這樣的人沒幾個 要好好珍惜頻率相合的人。,0
242,無論是藥物的衛教或是如何分辨現實或幻覺的技巧，,0
242,網路上的資源很多， 或是你可以到各精神科醫院索取，,0
242,都備有家屬的照顧手冊， 如果你想要找人問，,0
242,建議你可以打電話到精神科專科醫院， 通常有提供諮詢專線，,0
242,至於你想要找一些庇護工場或是職業訓練之類的，,0
242,應該需要由妳們住院的醫院的醫療團隊幫妳們轉介,0
242,如果你哥哥之前有住過院， 應該要詢問醫院的社工，,0
242,台中嘛. . . 有幾間精神科醫院你可以參考看看,0
242,維新醫院   台中市北區育德路185.,0
242,187號  財團法人台灣省私立台中仁愛之家附設靜和醫院,0
242,台中市西區南屯路一段156號  清濱醫院,0
242,台中縣清水鎮港埠路四段195號  清海醫院,0
242,台中縣石岡鄉石岡街下坑巷41之2號 ,0
242,陽光精神科醫院    台中縣清水鎮東山路68之1號,0
242,宏恩醫院龍安分院    台中市南區德富路145巷2號,0
242,希望以上的簡略敘述夠清楚， 加油吧！,0
243,吃軟便劑有噁心的感覺 嘔嘔嘔嘔嘔 銀行傳訊息來說,0
243,換印鑑的資料不齊 要補寄 我直接問了在那間銀行工作的人,0
243,他說給他他處理 好想吐啊：（ 明天下午要線上上課,0
244,昨天被老闆兇 然後焦慮 一直在想接下來要怎做,0
244,要待多久 一直去想像削弱我的力量 佔去我的重心的畫面,0
244,我承認我已焦慮 失去重心 不要想著蓋過去、,0
245,這一個禮拜都在忙報告沒有跟家人聊天，,0
245,想說打一下電話， 告知這一週的狀況。,0
245,結果家人一接就開始不停說教， 而且口氣非常差，,0
245,我從小到大都被她的言語凌辱和潑冷水，,0
245,真的已經夠了。  到後來自己也氣到說：我以後再也不打電話給你。,0
245,然後她回：好啊那都都不要打啊。  真的很擅長把情緒丟給我欸。,0
245,不過我也半斤八兩， 總是能找到最糟糕的字彙刺激她。,0
245,有的時候我覺得我們不像家人， 比較像仇人。,0
245,遇見了非得打個兩敗俱傷才甘願。   ,0
246,.  不論是用吊燈自縊還是從11樓往下跳,0
246,上天給了你不算差的才能和不算差的容貌,0
246,但你總是還沒看清楚牌局就把把 即使一手好牌都被你打爛了,0
246,碰到問題就逃避、 碰到問題就逃避 逃到最後就連活著都想逃避了,0
246,是啊 責任、 義務、 負擔、 苦短、,0
246,病痛、 過客 世界已經太多我承受不了的概念和事實,0
246,可是我還是連逃避活著都逃避了  . ,0
246,.     .     .  家裡人力不夠,0
246,現在在家當無給職看護 顧自家老人 塵囂.,0
247,早上跟動保員確認 他們結紮後會妥善照顧後才回放,0
247,送走了小貓1 親友跟我講了一些貓愛吃的好物,0
247,晚上將誘貓籠重新佈置 外觀用紙箱偽裝了一下,0
247,沒想到拿去放置的時候 正蹲下來要放食物,0
247,旁邊竟然有一隻貓的屍體 我真的嚇到了,0
247,臉色鐵青 但貓貓們都靠在附近偷看我在幹嘛,0
247,只能裝作冷靜不動聲色 回家就立馬打了1999,0
247,還好不到一小時清潔隊就派員 來帶去火化了,0
247,感謝他們晚上還有服務 去跟清潔隊員會合時,0
247,順便收籠 沒想到這次是大隻的母媽媽 最難騙的入籠了,0
247,可見肉泥跟天木蓼粉真的太吸引她了 拿籠子走時,0
247,她剩下的三隻幼貓 都在那邊晃盪似乎傻住了,0
247,媽媽不見了 希望可以順利全部帶去結紮,0
247,都平平安安回來 再讓他們一家團聚 家人太閒去招惹的,0
247,其實我不想弄 而且有時候覺得很不爽很煩,0
247,只是自己做事性格 做了還是會弄到一個程度,0
248,但我就爛 剛剛跟同事聊天 才知道他婚紗已經挑好了,0
248,但突然發現自己沒有被問 不過也是啦 我又沒結過婚,0
248,問我也不準 至少喜餅有問我款式 晚安晚安,0
248,晚上睡不好 很多質疑自己的聲音 都會在睡前跑出來,0
248,沒有不好 但我想回南部工作 醫生之前說你只是想省房租,0
248,對我只是想省一萬 一萬很多.    ,0
249,想一下 原來聽別人說話可以這麼不耐煩,0
249,才發現自己以前這麼有耐心的聽別人說話還幫忙想解決方案,0
249,勞費心力的 現在自己需要時卻發現沒有人可以聽,0
250,醫生很用心 說要三個月之後檢查追蹤 看我的三酸甘油脂有沒有正常,0
250,說不容易 但要加油：） 朋友說我很會看醫生,0
250,還說可以出書了 他說養貓都可以出書了,0
250,其實都只是醫生很好 很多醫生都很啊 ,0
251,抱怨文， 不喜勿入.  晚上抓到第三隻貓,0
251,不過昨晚腳癢到很難入睡 今天仔細看才發現,0
251,原來是一個一個紅豆包 應該是跳蚤 咬到整個右腳跟背奇癢無比,0
251,脾氣也整個上火 下午家人說 前天送去收容所結紮的貓送回來了,0
251,原本想原地放 但擔心傷口還沒好 左思右想,0
251,晚上又去採買一個中途籠跟貓砂盆 弄好已經晚上快九點,0
251,浪吞虎嚥吃完飯 再去置籠 連續兩天抓到貓,0
251,家人說收容所也好奇 怎麼第一次抓貓就上手？,0
251,？ ？  大概因為抓到的都是傻傻幼貓,0
251,原本設定要抓的母媽媽 根本都是門口把誘餌吃掉,0
251,就走了 家犬對於最近我忙於處理貓的事,0
251,很不滿意 今天因為陽台有兩隻貓 新抓的貓有稍微嗚咽,0
251,家犬更是直接守在客廳陽台門 賴著不進房間睡覺,0
251,一直抓門要出去 一邊做事一邊抓癢一邊覺得不爽,0
251,明明當初去搞事的事主不是我 而且事情不知道為什麼,0
251,越來越多 我還有其他更重要的事要處理,0
251,都怪那些貓 都會張著大眼睛水汪汪的 真是令人討厭,0
252,//. . /.  天還沒亮 3個多小時的車程,0
252,跑去雪場 不開心的心情也因為滑雪通通都沒了,0
252,讓自己運動流汗， 曬太陽， 會比較好一點,0
253,不知道哪來的白痴勇氣 居然又回去挑戰當時放棄的工作,0
253,搞到現在年紀比別人大， 能力比別人差，,0
253,對本行都忘了差不多了， 還成為大家的拖油瓶,0
253,也不知焦慮和敏感又發作 變的更自卑不敢與人互動,0
253,從以前現場變成現在辦公室 狀態感覺又回去了,0
253,對於工作無法掌握的狀態， 真的無力 該怎麼辦,0
254,這兩天搬了一些小東西 腰部就很不舒服,0
254,還是決定請搬家公司 2500省去我的復健科醫藥費,0
254,還有復健時間和上班時腰部不舒服   ,0
255,剛才室友偷翻我的包包 其實很恐懼欸 他不知道翻幾次了,0
255,我的家人啊 我這麼努力工作 努力治病,0
255,看醫生 回診 結果 是怎麼對我的 反正我也是習得無助，,0
256,明年的暑假就要畢業了可是 就沒有學校的諮商資源了,0
256,沒有人陪我講話了 我覺得我真的會瘋掉,0
257,原本是不太痛的體質， 但為了要旅遊上個月有吃調經的藥…,0
257,結果這次來直接大爆痛  同事剛剛已經有給我一顆止痛藥應急,0
257,但還是一直悶悶的陣痛. . .  聽說吃巧克力有用的,0
257,不過我真的超不嗜甜的…遙望公司零食櫃的金莎,0
257,想問一下大家有什麼推薦可以在便利商店就買的到的苦巧克力呢?,0
258,早上還好好的， 直到丟了訊息給朋友們,0
258,其中一位在回覆的內容感覺不是很妙 不想再丟訊息給他了,0
258,算命老師說我們之間會很多口舌 就別再自虐下去,0
259,桃園 台北有無推薦的精神科醫生 ? 朋友住在桃園中壢,0
259,因為情緒差有憂鬱症 請問桃園地區有無推薦的醫生,0
260,還是掛了特需齒科 掛這個才有名額 感謝手冊,0
260,還是在這邊把牙齒處理好了 好像拖不了那麼久,0
260,在連假的倒數第二天 痛了起來 大概兩三三個月,0
261,好想死好想死好想死 為什麼又來了 為什麼為什麼為什麼,0
262,他要結婚了 之前還問我用什麼交友軟體,0
262,笑死 結果要跟現任男友結婚 最後加班兩個時段,0
262,今天上班時段就結束了 加油     ,0
263,快到時間的時候 同類科的考生進來一個,0
263,嗚嗚敵人多一 快死背公文中     ,0
264,努力打工 希望我能專心打工 打工 是榮耀上帝,0
265,比較 是不是一件蠻傷人的事啊 不論在哪方面的比較,0
265,當然也有好的那種啦 但我就偶爾會把她跟她們在心裡做比較,0
265,覺得她不會 但妳為什麼會 因為覺得好像是一件傷人的事,0
265,所以有想法也不說出口 在心裡想想就好,0
265,覺得我莫名其妙可是 妳可能沒想過這背後的一兩句話,0
265,都是藏著我說過的不能忍受 可是當然我不再說妳就不知道,0
265,只會覺得我莫名其妙 像一顆慢慢累積能量的未爆彈,0
265,100%的時候我會果斷離開 然後妳依然會覺得我莫名其妙,0
265,覺得我自私 無情 不講理 因為我什麼都不講,0
265,我先道歉 我自私的覺得嚴重的討論過後妳會記得,0
265,所以自私的只想等妳發覺背後的意義 最後你還是什麼都不知道然後我自私的離開,0
265,自私的爛人 只會在心裡比較扣分 什麼都不說又愛生悶氣,0
266,如題， 大概治療了一年多左右， 心理上的壓力有減少一些，,0
266,但是生理上還是覺得非常非常 累， 平時也有定期的運動。,0
266,有時候會睡不著， 但為了上學或是維持生理時鐘，,0
266,還是睡個23個小時就爬起來。  有時候睡起來，,0
266,比鬧鐘早一點點， 但全身上下都很累。,0
266,都大學了， 課表還超像高中， 老師又不愛下課，,0
266,真的撐得好累。  下課也沒胃口吃晚餐，,0
266,只想衝回租屋處睡覺， 睡12個小時，,0
266,還是沒什麼胃口。 然後讀一 下書， 冥想一下然後試著睡著，,0
267,如果沒換工作 我可能不會面對這一顆根管,0
267,嗚嗚 新聞都會報說蛀牙細菌跑到腦部 也是很可怕,0
267,醫生也沒有很兇 （這很重要 一切都是最好的安排,0
268,活著比死亡還要更難。  總是浮現過往，,0
268,一個人時就忍不住哭，  生活好像變成只有基本的生存能力，,0
268,卻不知道怎麼活下去，  以前的同學的話讓我覺得很有道理：,0
268,因緣會來討要， 我們只能懺悔和虛心接受。,0
269,今天去診所回診 （跟媽媽達到共識， ,0
269,去醫院只打長效針跟拿藥，  其他事情去診所就好）,0
269,醫生開金菩薩給我 當初忘記為什麼不吃了,0
269,好像是因為副作用？  不管了 現在能減少躁的感覺就好,0
269,很怕隨時變躁狂 下禮拜三要去別的大醫院初診,0
269,希望醫師有耐心 開藥順利（？  最近對聲音有點敏感,0
270,看到很多人努力了很久才有他們今天的成就,0
270,可是我和他們努力的方向卻不一樣 是不是對我來說努力活下來就很好了呢？,0
270,我也想要有一些成就 可是我的精力卻不足以讓我朝那個方向努力,0
270,我常常在想是不是我還不夠努力 我是不是再多做一點什麼我就有力氣,0
271,關於的問題  簡單的回答是錯誤的問法無法得到正確的答案,0
271,臨床上大多數大量用藥個案基本上無法直接歸咎於醫師或是制度如何,0
271,通常是更為複雜的問題， 別忘了「病人」自身的責任,0
271,不僅限於精神科，   臨床上我們常看到許多病人拿著遠高於我們敢於開立劑量的止痛藥、,0
271,胃藥、 類固醇. . . 等  我們感到驚奇，,0
271,無論是我們自己缺乏高劑量使用的經驗或是病患的特殊需求,0
271,通常我們很難簡單論述這樣處方的是非 ,0
271,更遑論當一個病人得到某個處方並不是醫師單向指示的結果,0
271,僅僅只是討論「為什麼病人拿到那麼多的藥」,0
271,問題就不只是「會談、 衛教」或是「開藥」那麼簡單二選一的答案,0
271,最後的一個問題比較簡單一點  醫師與家人以及醫師與病人是截然不同的情境，,0
271,但作為一個醫師， 當他的家人把他當作是醫師來對待，,0
271,那結果就和一般病人情境無異  簡單地說，,0
271,如果還是「家人」那麼任何一位醫師都不必要開那麼多的藥物處方,0
271,但如果家人真的成為「病人」， 或許總有一天醫生會不得不開那麼多的藥物處方,0
272,這幾天狀態非常非常糟糕 又是為了那毫無希望的未來憂心,0
272,我已經沒有未來了 我已經沒有路可以走了,0
272,在撐不下去的心情中努力讓自己活著 但也許有一天我真的會撐不下去吧,0
272,想寫一點什麼 卻什麼都寫不出來 原來,0
272,最深刻的痛苦難以用文字表達 總之 我覺得我這35年的人生好失敗、,0
273,這幾天開始睡前滿焦慮的 有時候嚴重恐慌要吃鎮定劑,0
274,狗狗昨晚因送瓦斯的人來 所以把她抱進房間,0
274,避免過於警戒咬人 竟然從我手中掙脫往下跳,0
274,要去吠叫客人 當時真的嚇壞了 我怕她腿骨折,0
274,目前看起來還好 從小我就很注意 不要讓她太跳上跳下,0
274,怕對她未來骨結構不好 結果這傢伙 就這樣給我從一公尺高跳下去,0
274,真的是不要命了 實在很生氣又擔心 還好到今天,0
274,看起來都還正常 還要持續觀察 以後不抱了直接要她籠內等,0
274,實在是 馬麻那麼疼妳 卻一點都不珍惜自己啊,0
275,逼著自己出門兩天， 今天卻像沒電似的累。,0
275,懶的提筆畫畫， 懶的刷牙，  只想找人訴說，,0
275,胡亂的說也沒有關係。  等待， 然後消極的接受，,0
276,今天本來打算去加班的， 要不然下週一又要慌亂。,0
276,不過還是想躺床， 就這樣廢了整個白天。,0
276,沒洗衣服， 也沒洗澡。 看了一整天的真的很難戒除。,0
277,如題， 以前就有肚子痛， 可是最近越來越嚴重，,0
277,痛的時間也越長， 外加親戚有兩位都是死於大腸癌，,0
277,真的很怕自己也是得癌症， 大家覺得該放著還是乖乖看醫生，,0
278,我說的不是那種不舒服或是恐怖， 所以不敢看第二次的電影，,0
278,而是因為太感動了， 所以不敢看第二次，,0
278,怕哭到稀哩嘩啦. . . 我剛剛開電視，,0
278,看到電視在播春風化雨， 本來歡呼了一聲，,0
278,但是馬上轉台不看， 原因是我看這部片每看必哭，,0
278,所以絕對不敢再看><大家也有這種太過感動，,0
279,去諮商的前幾次就是把困住自己的故事講一講，,0
279,然後就漸漸地不知道要跟諮商師聊什麼了,0
279,。  明天又要去諮商了 再問個， 自從我的醫生知道我有在諮商後，,0
279,都只會開開藥， 問我睡得好嗎， 或者有沒有發,0
279,生什麼事。 雖然醫生本來就不必陪我聊聊，,0
280,昨天去聽演唱會就沒帶提款卡出門 大概這星期都不會帶出門,0
280,雖然無卡提款也可以 但那個帳戶沒什麼錢,0
280,最近也超過上限無法匯款 這樣好像無法吃利他能,0
280,但我只有吃週末 應該還好 買了期刊的權限,0
280,卻發現無法使用 哇咧 花兩萬買13.,0
280,3吋的閱讀器 也不知道是貨運途中被摔爛,0
280,還是本來就很爛 用起來超不順 螢幕還壞一條線,0
280,明天上班時間再看看有沒有救 打過去問看看,0
280,看能不能保固內維修之類的 今天回家的時候,0
280,看到長長的送葬隊伍 原來是對面鄰居的奶奶今天告別式,0
280,那個奶奶的看護今年要回印尼 聽說是好幾年的看護了,0
280,這個時間走可能也不是件壞事？  想到自己年老孤苦無依就覺得可怕,0
280,還不存錢啊 雖然合約還有一段時間到期,0
280,但已經無時不刻想著要回南部工作了 雖然醫生在台北,0
280,但每個月的房租可以來回北高三次 生活費又不止,0
280,雖然回南部想去有宿舍的公司 但一切都是未知數,0
280,還沒投履歷也還沒面試 一切都是未知 ,0
280,默默的增加兩個粉絲 心理師還有發摟也蠻開心的,0
280,明天要去看醫生 不知道心理衡鑑的結果出來沒,0
281,這兩天睡太少又太忙， 早上起來發現如廁有點痛跟頻尿，,0
281,跟去年第一次尿道炎很像， 但去年超痛！,0
281,之後有吃抗生素一個禮拜， 現在我狂喝水+蔓越莓乾（家裡只有這個），,0
281,我還打了胡蘿蔔汁（應該對尿道炎沒效？,0
281,）， 現在是稍微頻尿， 幾乎不會痛，,0
281,如果好了， 不會不舒服， 還需看醫生嗎?因為不喜歡吃藥，,0
281,但明天放假又怕復發。 看醫生健保不會太貴？,0
281,之前去大樹藥局那藥（假日沒有診所開），,0
281,一個禮拜竟要930！ 嚇到我了。 用手機發表，,0
282,雖然心情怪怪的 但是走一走突然出現的彩虹,0
282,好像讓人覺得有一點點幸運的感覺 祝大家,0
284,考試倒數98天了 最近常常做惡夢 夢到許多現實中的現實,0
284,只有吃思樂康的日子才會有美夢 大家都說南部新公司很操,0
284,但是現實中的現實又有誰能解 自己 和對方高層說好,0
284,沒有立即離開原職的立即性 目前專業各方面頗有好評,0
284,若貴公司還有職缺待約滿再投履歷 對方蠻喜歡我的,0
284,要我結束前都要跟他們保持聯絡    ,0
285,期待那久違的一句好久不見 好喜歡醫生：）,0
285,這些日子彷彿都不孤獨了 移情醫生也好也好,0
285,起碼比情人穩定些（深深相信 昨天尾牙今天拉肚子,0
285,還有一點感冒 晚上的見面其實沒什麼期待,0
285,只有工具人可以帶我出去走走 謝謝上天創造工具人,0
286,早上考完了 上次心理學翻車 這次有猜中一題,0
286,但申論很難說 還有大概兩個小時考剩下的兩科,0
286,加油加油 堅持到交卷的那一刻    ,0
287,等到有一天 我都看懂 我所努力的一切都很荒謬,0
287,而且徒勞無功 我就理解了人生 我們都只是棋子,0
287,能在楚門的世界外看著表演的人 都不是楚門,0
288,作息很亂， 晚上常睡不著， 迷糊睡著卻睡到下午。,0
288,這陣子總是夢見你， 夢中你是活著的，,0
288,卻總是沒有說上話。  是不是我想要儘量不再提起，,0
288,讓你好好安息，  反而壓抑， 結果出現在夢中呢？,0
289,明天要解隔離 一晃眼10月要過去 我還好好的活著,0
289,希望好好唸書 工作順利 生活健康 加油,0
290,諮商結束了 但卻不代表我好了 唉 累累的,0
290,雷雷的 真不知父母把我生下來幹嘛 明天又要上班了,0
291,我會希望， 是有緣分能遇到一個能看見自己特質，,0
291,因為喜歡這份特質， 發自內心願意對我,0
292,早上出門 三個刑警衝到我前面 問我可以幫他們開大門嗎？,0
292,他們有出示證件 然後拿了照片問我認不認識,0
292,我說沒看過 他們問我房東電話 我指著外面的廣告上面就有寫,0
292,我想說是刑事案件 如果有什麼屍體吸毒的,0
292,會很麻煩 還是讓他們進去 就問他們有沒有搜索票,0
292,他們拿給我看之後 我就幫他們開門了 ,0
293,可能生理期的關係， 身體很累， 思考很負面,0
293,今天上陶藝課時， 同學們有聊到工作的話題，,0
293,我今天都沒和同學互動， 因為不敢講現況，,0
293,作品也只做一件 現在又想著求職的問題，,0
293,想去澳洲， 但破英文實在沒有辦法找到什麼非勞力性質的工作，,0
293,走回專業本科， 國考一直考不上， 對法律也不是有極大熱情，,0
293,沒有證照， 我真的抬不起頭 來服務案主，,0
293,況且我只是個進修部畢業的， 怎麼想都覺得爛到極點,0
293,但不工作也不行， 想再唸書， 家裡不支持，,0
293,我自己也沒有底氣、 能力、 毅力打拼，,0
293,做什麼 都不行， 發展停滯， 要努力起來啊啊啊，,0
293,就算沒有任何專長、 專業原來找工作很難，,0
294,在等剪頭髮 剛剛去上廁所 結果衛生紙丟馬桶,0
294,啊他本來就有點塞住了 （沖水的時候才發現,0
295,就是那部電影 剛剛看完了 是真的救活了嗎,0
295,房子又燒掉了嗎 看不懂 在媽媽發病之後,0
295,就好難認清到底哪些是真的 也可能只是我笨而已,0
295,不過醫院的場景還真熟悉 哈哈 他總是會有奇怪的舉動,0
295,讓我覺得莫名的很慌 只要跟清醒的時候有一點點不一樣,0
295,只要一點點 就可以讓我恐慌指數升到最高,0
295,我很討厭這樣 因為陰影散不掉 我也什麼都講不出口,0
295,像個蹲在角落挨情緒打的笨蛋 為什麼我要承受你們的爛婚姻,0
295,是整個電影記最清楚的一句話 是啊 為什麼,0
295,我好像找到一直去上班不排休的原因了 賺錢是一個,0
295,另一個大概就是逃離這個不穩定的地方 因為這些不穩定總有一天會讓我完全爆炸,0
295,等到忍不下去的時候 要開學了 距離上次諮商已經是好幾個月前,0
295,上學期完全沒有去 一直好猶豫要不要去,0
295,要諮商就要犧牲睡眠時間 想睡覺 也許雨一停，,0
295,我還能再見到你，  也許雨該一直下不停。,0
296,這幾天家犬過敏老毛病發作 幫她腳趾頭擦藥,0
296,順便修一下過長的指甲 她生氣起毛跟我低吼,0
296,甩頭就逃跑 實在有點無奈 小小一隻也很有脾氣,0
296,還要跟他好聲好氣道歉秀秀 可愛又可惡,0
296,是捨不得她生病 持續心情悶悶的 週末昏睡很久,0
297,昨天看了新竹大火那則新聞 心情很悲痛,0
297,但卻又重複看 晚上看的韓劇演到生離死別,0
297,睡前想到過世的阿婆大哭 剛又不小心看到大火的新聞，,0
297,想到一下失去這麼多親人就好痛心 現在整個被悲痛情緒籠罩,0
297,假日本來該好好休息的， 但卻有一點發作的感覺,0
298,已經很久沒有吃藥了， 自行停藥9個月,0
298,現在ㄧ切又重頭來過， 回到原點 重新吃藥變的很想睡，,0
298,整天昏昏沈沈的 停藥復發真的很慘 請問重新吃藥想睡正常嗎？,0
299,教出兩個不會讀書也沒成就的小孩 真是辛苦你們了,0
299,講得外面的世界就是薪水低、 白做工 那是你們的世界,0
299,因為你們只能接觸到那樣層級的人 你們就是那種層級的人還看不清,0
299,不然以為從小菁英教育的受薪階級的家庭怎麼養得起小孩？,0
299,龍生龍 鳳生鳳 老鼠的小孩會打洞 拜託不要讓後代繼承這種沒格調又賺不多的公司好嗎？,0
300,最近都一個禮拜洗一次澡 太累了 我每天都在摧殘著自己,0
301,如果病人可以配合. . . 那為何要防護人力、,0
301,"為何要約束= =。 很多書本的概念都太執著在""個人""上，",0
301,會忘了其實病房是一個封閉性的環境， ,0
301,"""病人們""是一個團體， 我們在執行處置、",0
301,會談或是衛教時， 常會認為我們是在對一個病人講，,0
301,其實. . . 旁邊的病人都在看著。,0
301,以你提到的暴力約束為例， 在執行隔離約束有兩個概念,0
301,1. 減少傷害   2. 行為治療，,0
301,在啟動程序前， 我們自己要有概念， 這次為何要執行處置，,0
301,到對峙時才會名正而言順， 正氣到連旁邊的躁症病人都會跳出來幫忙罵…。,0
301,另外， 動用到人力時， 快、 狠、 準是關鍵，,0
301,會談在這時只是讓其他病人跟防護人員知道為何要這樣處置，,0
301,讓病人理解處置原因， 最好是等到約束後或冷靜後，,0
301,因為這時你才能針對病人的病情、 性格去做個別性的會談，,0
301,舉例來說. . . 跟在大廳對峙. .,0
301,. 只是給他舞台罷了， 在保護室看他演給誰看=,0
301,=， 就算出保護室後去跟其他病人抱怨，,0
301,其他病人也都了解處置原因， 也比較不會被操控,0
302,大概從明天開始又要開啟一週的烤肉週了，,0
302,雖然還沒人約本肥烤肉， 但怕要是有人約肥肥烤肉的話，,0
302,總是不能空手去吧， 但又怕帶到地雷食物去，,0
302,這樣很尷尬耶。 所以想問問， 大家最討厭看到的烤肉食材是?,0
303,剛剛跟醫生說 多一個領域專長 也不見得是壞事,0
303,公司要重點培養這件事 對我來說也是一件好事,0
303,至少是一種學習 雖然事情很多很幹 領一個人的薪水做兩三個人的事,0
303,公部門以外是這樣的 他們不會花一個人的薪水請一個人,0
303,會希望請到的是可以多元的人 雖然要自己花點錢上課,0
303,但至少是表示忠心的方法 都已經33歲了,0
303,還可以被賦予重望 而且公司已經把專家請到你面前,0
303,只要你想學都不是難事 如果一直考不上,0
303,也是對一個專長 莫泊桑《一生》 生活不可能像你想像的那麼好，,0
